{"acceptance":{"comparison_binding_equal_across_arms":true,"complete_starts_per_arm":3,"effectiveness_requires_process_coverage":1,"h1_falsifier":"ecpa-claims-effective-with-incomplete-coverage-or-required-event-coverage-below-0.99","paper_result_gate":"all-nine-starts-validator-approved"},"admissible":true,"arms":["vanilla-vllm-entry-points","manual-integration","ecpa"],"blockers":[],"comparison_unit":"scenario-by-repetition-across-three-arms","experiment_id":"EXP-FE-PARTIAL-WORKER","fixed_identity":{"accelerator_plugin_commit":"873584026f8a683ac73523f15127569e9f6ab34b","container_digest":null,"environment_digest":"sha256:d8e9b7d1fee667b6c8f3ee0525a7c1ef9bfe78d025c8ade24e3b372f625eb027","fault_descriptor_sha256":"sha256:83cf593eda175a7a8c809350a6456bb1070bcba25e3b341c9c6598db16d46a17","hardware":"Ascend 910B2","manager_commit":"e583852ac3cb7ea0003ac4b5798c09d369151514","model":"Qwen/Qwen2.5-7B-Instruct@a09a35458c702b33eeacc393d103063234e8bc28","plugin_entry_point":{"group":"vllm.general_plugins","name":"kv_materialization","value":"vllm_kv_materialization.plugin:register_plugin"},"runtime_commit":"973d9ef5acd2b9beb03e399dec1511a41fc941b5","topology":"single-host TP2 eager","warm_state":"cold","workload_request_sha256":"sha256:9ff24793404386289eb61866b57f6943914af8f46317af28dc60c279e777198d"},"non_claims":["This preregistration is not a formal-real result.","The evidence-quarantine fault does not show that a worker stopped executing the plugin.","A completed partial-worker-coverage study does not establish rollback or performance claims.","The study does not establish cross-runtime generality or an industry standard."],"outcomes":["false_effective_by_arm","required_event_coverage_by_arm","failure_detection_latency_ms","incomplete_exposure_window_ms","raw_failure_count_by_arm"],"phase_authorities":[{"authority":"lifecycle-source","does_not_prove":"Plugin invocation, process coverage, or policy effect.","phase":"service-ready","proves":"The exact loopback service endpoint returned the registered status within the bounded probe.","source_kind":"readiness-probe","source_subcommand":"readiness-http"},{"authority":"lifecycle-source","does_not_prove":"Which plugin or policy influenced the response.","phase":"workload-complete","proves":"The registered canonical request produced a non-empty OpenAI choices response.","source_kind":"workload-driver","source_subcommand":"workload-http"},{"authority":"lifecycle-source","does_not_prove":"Worker death, plugin deactivation, or Plan mutation.","phase":"fault-injected","proves":"Exactly one bound worker evidence journal was transactionally quarantined while a peer remained.","source_kind":"fault-actuator","source_subcommand":"partial-coverage-quarantine"},{"authority":"vllm-hust-host","does_not_prove":"Lifecycle phases owned by readiness, workload, fault, or shutdown sources.","phase":"observer-captured","proves":"The frozen host journal contains Plan-, launch-, frozen-process-bound loader invocation and matching runtime-effective events.","source_kind":"host-observer","source_subcommand":"journal-capture"},{"authority":"process-monitor","does_not_prove":"Successful rollback or preservation of an external service.","phase":"service-shutdown","proves":"The exact PID, start ticks, and argv identity exited.","source_kind":"process-monitor","source_subcommand":"shutdown-process"}],"planned_starts":9,"producer_candidate":{"base":"fc06902b7dd7aa1610438cd061ccf7f04b31c609","human_line_review":true,"merge_commit":"b326fafe5405b9996db9c9f0d7758536148ecc9b","observed_at":"2026-10-12T20:28:43+08:00","observed_state":"merged","pull_request":27,"repository":"vLLM-HUST/vllm-hust","reviewed_head":"f3eb4b09ba91a1720c4e35de41a91e6dc351fd5b","reviewed_tree":"bcdb8c810b60c11e77cb8af2002bd9039600b808"},"repetitions":3,"required_host_observables":["service-ready","workload-complete","fault-injected","observer-captured","service-shutdown","activation-path","effective-claim","plugin-invoked","coverage"],"scenario":"partial-worker-coverage","schedule":[["vanilla-vllm-entry-points","manual-integration","ecpa"],["manual-integration","ecpa","vanilla-vllm-entry-points"],["ecpa","vanilla-vllm-entry-points","manual-integration"]],"schema":"ecpa-first-formal-real-study/v1","status":"admitted","study_id":"partial-worker-coverage-three-arm-v1","truth":{"activation_possible_after_fault":false,"baseline_outcome_assumed":false,"effectiveness_requires_complete_process_coverage":true}}
